{
  "schemaVersion": 1,
  "meeting": {
    "id": "Claude meetup 1",
    "title": "Claude Meetup 1 社群交流",
    "location": "AWS 新加坡場地",
    "language": "zh-TW",
    "generatedAt": "2026-06-01T02:21:17+08:00",
    "sourceLanguages": [
      "en"
    ]
  },
  "hero": {
    "kicker": "社群聚會",
    "headline": "從 AI coding workflow 到 agent 記憶架構，現場聚焦實作與安全",
    "dek": "這場聚會先由 Max 分享自己如何把 Claude、Codex、Linear 與多種工具串成產品開發流程，再由 AWS、YQ 與 Ian 分別談到 Claude on AWS、供應鏈安全 sandbox，以及以推理為核心的 agent 記憶系統。"
  },
  "agenda": [
    "主辦人開場、社群與後續活動資訊",
    "Max 分享個人 AI 開發工作流與產品實作方式",
    "AWS 介紹 Bedrock 上的 Claude 與相關活動",
    "YQ 展示 Dependency Guard 與 sandbox 驗證 package 安全",
    "Ian 分享記憶優先的 agent 系統 Kybernesis"
  ],
  "attendees": [
    "Max",
    "Zul",
    "YQ",
    "Ian",
    "AWS 團隊",
    "Claude 社群與現場與會者"
  ],
  "highlights": [
    {
      "title": "Max 用 AI 工具重組產品開發流程",
      "body": "Max 以自己正在打造的短租 SaaS 產品為例，說明他會先用 Claude、Perplexity 與 Codex 把需求拆解清楚，再透過 Linear MCP 把規格、子任務與驗收條件整理成 issue，最後讓 Claude Code 逐項實作並同步回寫進度。"
    },
    {
      "title": "多模型交叉檢查成為工作習慣",
      "body": "他強調不要只依賴單一工具，會用 Codex review、Advisor、PR review 與其他 coding agent 交叉驗證結果；在他的經驗裡，原本可能要兩個月以上的功能，現在可在十多小時內完成。"
    },
    {
      "title": "YQ 把供應鏈安全前移到安裝前",
      "body": "YQ 展示 Dependency Guard 如何攔截 `npm install`，先透過 Socket 做套件信譽檢查，再用 sandbox 模擬安裝與監看檔案、網路與異常程序，避免惡意套件在本機真正落地前就先造成外洩。"
    },
    {
      "title": "Ian 主張『推理就是記憶』",
      "body": "Ian 分享他為 agent 打造的記憶系統 Kybernesis：不只把資料存起來，而是在背景持續做 sleep-time reasoning，建立實體與事件之間的關聯，讓系統之後能用更低 token 成本做更準確的 recall。"
    }
  ],
  "decisions": [
    "本次聚會採用短講加中場休息的實驗性流程，讓與會者有時間交流與補給。",
    "主辦方持續以社群活動、工作坊與跨國講者分享，推進 Claude 與 AI agent 實作交流。"
  ],
  "actionItems": [
    {
      "owner": "有興趣的與會者",
      "task": "加入 Max 管理的 WhatsApp 社群，以便優先取得後續活動與講者資訊。"
    },
    {
      "owner": "想深入實作的技術參與者",
      "task": "評估報名隔天的進階工作坊，進一步學習 marketing automation、SEO 與多代理系統實作。"
    },
    {
      "owner": "關注 agent 安全的開發者",
      "task": "研究以 sandbox 與 reputational checks 驗證第三方套件與技能來源的可行流程。"
    }
  ],
  "quotes": [
    "「我不是工程師出身，但 Claude 真的改變了我的人生，現在我把大部分時間都花在寫程式上。」",
    "「安全會越來越重要；真正能幫我們安全委派工作的，會是 sandboxed agents。」",
    "「推理本身就是記憶。」"
  ],
  "closingNote": "整場氣氛偏技術導向，但內容很務實：一方面討論如何把 AI coding 工具接進真實產品流程，另一方面也不避談安全、記憶與長期可維運性。對之後想回看這頁的人來說，這是一場把『如何真的把 agent 用進工作』講得很具體的聚會。"
}
